0186,User,Practitioner Category,Table of codes specifying the category of practitioner.  No suggested values.,PractitionerCategory,pa,N/A (0),PRA-3,,,2.16.840.1.113883.12.186,,,,,10,2.2,2.9,
0187,HL7,Provider Billing,HL7-defined table of codes specifying how provider services are billed.,ProviderBilling,pa,Universal (3),PRA-4,,,2.16.840.1.113883.12.187,2.16.840.1.113883.18.99,http://terminology.hl7.org/CodeSystem/v2-0187,2.16.840.1.113883.21.111,http://terminology.hl7.org/ValueSet/v2-0187,10,2.2,2.9,1
0188,User,Operator ID,Table of codes specifying the individual responsible for triggering the event.  No suggested values.,,pa,N/A (0),EVN-5,,,2.16.840.1.113883.12.188,,,,,10,2.2,2.9,
0189,User,Ethnic Group,"Table of codes further defining a patient's ancestry.  In the US, a current use is to use these codes to report ethnicity in line with US federal standards for Hispanic origin.",EthnicGroup,pa,Example (1),PID-22,,,2.16.840.1.113883.12.189,2.16.840.1.113883.18.100,http://terminology.hl7.org/CodeSystem/v2-0189,2.16.840.1.113883.21.112,http://terminology.hl7.org/ValueSet/v2-0189,10,2.2,2.9,1
0190,HL7,Address Type,HL7-defined table of codes specifying types or kinds of addresses.,AddressType,inm,Universal (3),"XAD.8, AD.7",,,2.16.840.1.113883.12.190,2.16.840.1.113883.18.101,http://terminology.hl7.org/CodeSystem/v2-0190,2.16.840.1.113883.21.113,http://terminology.hl7.org/ValueSet/v2-0190,10,2.2,2.9,1
0191,HL7,Type of Referenced Data,HL7-defined table of codes declaring the general type of media data that is encoded.,TypeOfReferencedData,fm,Universal (3),TXA-3,,,2.16.840.1.113883.12.191,2.16.840.1.113883.18.102,http://terminology.hl7.org/CodeSystem/v2-0191,2.16.840.1.113883.21.114,http://terminology.hl7.org/ValueSet/v2-0191,10,2.2,2.9,1
0192,User,Visit ID Type,HL7-defined table of concepts defining whether patient transportation preparations are in place.,VisitIDType,,N/A (0),,does not exist?,,2.16.840.1.113883.12.192,,,,,10,2.2,2.9,
0193,User,Amount Class,Table of codes specifying the amount quantity class.,AmountClass,fm,Example (1),PTA.2,,,2.16.840.1.113883.12.193,2.16.840.1.113883.18.103,http://terminology.hl7.org/CodeSystem/v2-0193,2.16.840.1.113883.21.115,http://terminology.hl7.org/ValueSet/v2-0193,10,2.2,2.9,1
0200,HL7,Name Type,HL7-defined table of codes for types of names for persons.,NameType,inm,Universal (3),"XPN.8, PPN.10, XCN.10, PID-5, MRG-7",,,2.16.840.1.113883.12.200,2.16.840.1.113883.18.105,http://terminology.hl7.org/CodeSystem/v2-0200,2.16.840.1.113883.21.117,http://terminology.hl7.org/ValueSet/v2-0200,10,2.3,2.9,1
0201,HL7,Telecommunication Use Code,HL7-defined table of codes for specifying a specific use of a telecommunication number.  Best practice is to use this concept whenever a telecommunication number or access string is specified.,TelecommunicationUseCode,inm,Universal (3),XTN.2,,,2.16.840.1.113883.12.201,2.16.840.1.113883.18.106,http://terminology.hl7.org/CodeSystem/v2-0201,2.16.840.1.113883.21.118,http://terminology.hl7.org/ValueSet/v2-0201,10,2.3,2.9,1
0202,HL7,Telecommunication Equipment Type,HL7-defined table of codes  for specifying a type of telecommunication equipment.  Best practice is to use this concept whenever a telecommunication number or access string for particular equipment is specified.,TelecommunicationEquipmentType,inm,Universal (3),XTN.3,,,2.16.840.1.113883.12.202,2.16.840.1.113883.18.107,http://terminology.hl7.org/CodeSystem/v2-0202,2.16.840.1.113883.21.119,http://terminology.hl7.org/ValueSet/v2-0202,10,2.3,2.9,1
0203,HL7,Identifier Type,HL7-defined table of codes specifying the type of identififier.,IdentifierType,inm,Representative (2),"CX.5, PPN.13, XCN.13, XON.7",,,2.16.840.1.113883.12.203,2.16.840.1.113883.18.108,http://terminology.hl7.org/CodeSystem/v2-0203,2.16.840.1.113883.21.120,http://terminology.hl7.org/ValueSet/v2-0203,10,2.3,2.9,1
0204,User,Organizational Name Type,"Table of codes used to specify the type of name for an organization i.e., legal name, display name.",OrganizationalNameType,inm,Example (1),"XON.2, PD1-3",,,2.16.840.1.113883.12.204,2.16.840.1.113883.18.109,http://terminology.hl7.org/CodeSystem/v2-0204,2.16.840.1.113883.21.121,http://terminology.hl7.org/ValueSet/v2-0204,10,2.3,2.9,1
0205,HL7,Price Type,HL7-defined table of codes used to identify the intent for the dollar amount on a pricing transaction.,PriceType,inm,Universal (3),CP.2,,,2.16.840.1.113883.12.205,2.16.840.1.113883.18.110,http://terminology.hl7.org/CodeSystem/v2-0205,2.16.840.1.113883.21.122,http://terminology.hl7.org/ValueSet/v2-0205,10,2.3,2.9,1
0206,HL7,Segment Action Code,"HL7-defined table of codes specifying actions to be applied for segments when an HL7 version 2 interface is operating in ""action code mode"" (a kind of update mode in the Standard).",SegmentActionCode,inm,Universal (3),"CH2, RXA-21, RXV-22, LCH-2, IAM-6, ARV-2, IN1-55, OH1",,,2.16.840.1.113883.12.206,2.16.840.1.113883.18.111,http://terminology.hl7.org/CodeSystem/v2-0206,2.16.840.1.113883.21.123,http://terminology.hl7.org/ValueSet/v2-0206,10,2.3,2.9,1
0207,HL7,Processing Mode,HL7-defined table of codes that indicate an archival process or an initial load process.,V2ProcessingMode,inm,Universal (3),PT.2,,,2.16.840.1.113883.12.207,2.16.840.1.113883.18.112,http://terminology.hl7.org/CodeSystem/v2-0207,2.16.840.1.113883.21.124,http://terminology.hl7.org/ValueSet/v2-0207,10,2.3,2.9,1
0208,HL7,Query Response Status,"HL7-defined table of codes defining precise response status concepts in support of HL7 Version 2 query messaging.  It is commonly used to indicate no data is found that matches the query parameters, but no error.",QueryResponseStatus,inm,Universal (3),QAK.2,,,2.16.840.1.113883.12.208,2.16.840.1.113883.18.113,http://terminology.hl7.org/CodeSystem/v2-0208,2.16.840.1.113883.21.125,http://terminology.hl7.org/ValueSet/v2-0208,10,2.3,2.9,1
0209,HL7,Relational Operator,HL7-defined table of codes used to define the relationship between HL7 segment field names identified in a query construct.,V2RelationalOperator,inm,Universal (3),QSC.2,,,2.16.840.1.113883.12.209,2.16.840.1.113883.18.114,http://terminology.hl7.org/CodeSystem/v2-0209,2.16.840.1.113883.21.126,http://terminology.hl7.org/ValueSet/v2-0209,10,2.3,2.9,1
0210,HL7,Relational Conjunction,HL7-defined table of codes used with relational operator values to group more than one segment field name.,RelationalConjunction,inm,Universal (3),QSC.4,,,2.16.840.1.113883.12.210,2.16.840.1.113883.18.115,http://terminology.hl7.org/CodeSystem/v2-0210,2.16.840.1.113883.21.127,http://terminology.hl7.org/ValueSet/v2-0210,10,2.3,2.9,1
0211,HL7,Alternate Character Sets,"Table of codes that identify one of a number of possible standard alternate character sets for a message, either single-byte or double-byte.",AlternateCharacterSets,inm,Universal (3),MSH-18,,,2.16.840.1.113883.12.211,2.16.840.1.113883.18.116,http://terminology.hl7.org/CodeSystem/v2-0211,2.16.840.1.113883.21.128,http://terminology.hl7.org/ValueSet/v2-0211,10,2.3,2.9,1
0212,User,Nationality,"Table of codes that identify the nation or national grouping to which the person belongs.  This information may be different from a persons citizenship in countries in which multiple nationalities are recognized (for example, Spain: Basque, Catalan, etc.).  No suggested values.",Nationality,,N/A (0),"NK1-27, GT1-43. IN1-41,",,,2.16.840.1.113883.12.212,,,,,10,2.3,2.9,
0213,User,Purge Status Code,Table of codes used to define the state of a visit relative to its place in a purge workflow.,PurgeStatusCode,pa,Example (1),PV2-16,,,2.16.840.1.113883.12.213,2.16.840.1.113883.18.117,http://terminology.hl7.org/CodeSystem/v2-0213,2.16.840.1.113883.21.129,http://terminology.hl7.org/ValueSet/v2-0213,10,2.3,2.9,1
0214,User,Special Program Code,Table of codes used to record a health insurance program required for healthcare visit reimbursement.,SpecialProgramCode,pa,Example (1),PV2-18,,,2.16.840.1.113883.12.214,2.16.840.1.113883.18.118,http://terminology.hl7.org/CodeSystem/v2-0214,2.16.840.1.113883.21.130,http://terminology.hl7.org/ValueSet/v2-0214,10,2.3,2.9,1
0215,User,Publicity Code,Table of codes specifying a level of publicity of information about a patient for a specific visit.,PublicityCode,pa,Example (1),"PV2-21, PD1-11",,,2.16.840.1.113883.12.215,2.16.840.1.113883.18.119,http://terminology.hl7.org/CodeSystem/v2-0215,2.16.840.1.113883.21.131,http://terminology.hl7.org/ValueSet/v2-0215,10,2.3,2.9,1
0216,User,Patient Status Code,Table of codes used to define the state of a care episode for a patient.,PatientStatusCode,pa,Example (1),PV2-24,,,2.16.840.1.113883.12.216,2.16.840.1.113883.18.120,http://terminology.hl7.org/CodeSystem/v2-0216,2.16.840.1.113883.21.132,http://terminology.hl7.org/ValueSet/v2-0216,10,2.3,2.9,1
0217,User,Visit Priority Code,Table of codes used to define a relative level of urgency applied to a patient visit.,VisitPriorityCode,pa,Representative (2),PV2-25,,,2.16.840.1.113883.12.217,2.16.840.1.113883.18.121,http://terminology.hl7.org/CodeSystem/v2-0217,2.16.840.1.113883.21.133,http://terminology.hl7.org/ValueSet/v2-0217,10,2.3,2.9,1
0218,User,Patient Charge Adjustment,"Table of codes used to indicate which adjustments should be made to a guarantors charges.  For example, when a hospital agrees to adjust a guarantors charges to a sliding scale.  No suggested values.",PatientChargeAdjustment,pa,N/A (0),GT1-26,,,2.16.840.1.113883.12.218,,,,,10,2.3,2.9,
0219,User,Recurring Service Code,Table of codes used to indicate whether a treatment is continuous.  No suggested values.,RecurringServiceCode,pa,N/A (0),PV2-31,,,2.16.840.1.113883.12.219,,,,,10,2.3,2.9,
0220,User,Living Arrangement,Table of codes characterizing the situation that patient-associated parties live in at their residential address.,V2LivingArrangement,pa,Example (1),"NK1-21, PD1-2",,,2.16.840.1.113883.12.220,2.16.840.1.113883.18.122,http://terminology.hl7.org/CodeSystem/v2-0220,2.16.840.1.113883.21.134,http://terminology.hl7.org/ValueSet/v2-0220,10,2.3,2.9,1
0222,User,Contact Reason,"Table of codes used to indicate a reason for contacting a guarantor, for example, to phone a guarantor if payments are late.  No suggested values.",ContactReason,fm,N/A (0),"GT1-47, NK1-29",,,2.16.840.1.113883.12.222,,,,,10,2.3,2.9,
0223,User,Living Dependency,"Table of codes identifying specific living conditions (e.g., spouse dependent on patient, walk-up) that are relevant to an evaluation of the patient's healthcare needs.",LivingDependency,pa,Example (1),"NK1-17, PD1-1",,,2.16.840.1.113883.12.223,2.16.840.1.113883.18.124,http://terminology.hl7.org/CodeSystem/v2-0223,2.16.840.1.113883.21.136,http://terminology.hl7.org/ValueSet/v2-0223,10,2.3,2.9,1
0224,HL7,Transport Arranged,HL7-defined table of codes defining whether patient transportation preparations are in place.,TransportArranged,oo,Universal (3),OBR-41,,,2.16.840.1.113883.12.224,2.16.840.1.113883.18.125,http://terminology.hl7.org/CodeSystem/v2-0224,2.16.840.1.113883.21.137,http://terminology.hl7.org/ValueSet/v2-0224,10,2.3,2.9,1
0225,HL7,Escort Required,HL7-defined table of codes indicating whether a patient must be accompanied while travelling to a diagnostic service department.,EscortRequired,oo,Universal (3),OBR-42,,,2.16.840.1.113883.12.225,2.16.840.1.113883.18.126,http://terminology.hl7.org/CodeSystem/v2-0225,2.16.840.1.113883.21.138,http://terminology.hl7.org/ValueSet/v2-0225,10,2.3,2.9,1
0227,Imported,Manufacturers of Vaccines (code=MVX),"Table of codes specifying the organization that manufactures a vaccine. The values are maintained by the US Centers of Disease Control.  Note that the source of truth for these code values are maintained by the CDC, and the code system may be accessed at URL: https://phinvads.cdc.gov/vads/SearchCodeSystems_search.action?searchOptions.searchText=PH_ManufacturersOfVaccinesMVX_CDC_NIP.  The value set is also maintained by the CDC, and may be accessed at URL: https://phinvads.cdc.gov/vads/SearchValueSets_search.action?searchOptions.searchText=PHVS_ManufacturersOfVaccinesMVX_CDC_NIP",ManufacturersOfVaccines,oo,N/A (0),"RXA-17, RXD-20, RXG-21",,UTG Missing CodeSystem,2.16.840.1.113883.12.227,2.16.840.1.113883.12.227,http://terminology.hl7.org/CodeSystem/v2-0227,2.16.840.1.114222.4.11.826,http://terminology.hl7.org/ValueSet/v2-0227,10,2.3,2.9,1
0228,User,Diagnosis Classification,Table of codes used to classify whether a patient visit can be related to a diagnosis.,DiagnosisClassification,fm,Example (1),DG1-17,,,2.16.840.1.113883.12.228,2.16.840.1.113883.18.128,http://terminology.hl7.org/CodeSystem/v2-0228,2.16.840.1.113883.21.140,http://terminology.hl7.org/ValueSet/v2-0228,10,2.3,2.9,1
0229,User,DRG Payor,Table of codes used to identify a Diagnostic Resource Group Payor.  US Realm.  No suggested values.,DrgPayor,fm,N/A (0),IN3-12,,,2.16.840.1.113883.12.229,,,,,10,2.3,2.9,
0230,User,Procedure Functional Type,Table of codes used to classify a procedure.,ProcedureFunctionalType,fm,Example (1),PR1-6,,,2.16.840.1.113883.12.230,2.16.840.1.113883.18.130,http://terminology.hl7.org/CodeSystem/v2-0230,2.16.840.1.113883.21.142,http://terminology.hl7.org/ValueSet/v2-0230,10,2.3,2.9,1
0231,User,Student Status,Table of codes used to designate whether a guarantor is a full or part time student.,StudentStatus,fm,Representative (2),"GT1-40, NK1-24, PD1-5",,,2.16.840.1.113883.12.231,2.16.840.1.113883.18.131,http://terminology.hl7.org/CodeSystem/v2-0231,2.16.840.1.113883.21.143,http://terminology.hl7.org/ValueSet/v2-0231,10,2.3,2.9,1
0232,User,- Insurance Company Contact Reason,Table of codes used to describe why an insurance company has been contacted.,InsuranceCompanyContactReason,fm,Example (1),IN2-57,,,2.16.840.1.113883.12.232,2.16.840.1.113883.18.132,http://terminology.hl7.org/CodeSystem/v2-0232,2.16.840.1.113883.21.144,http://terminology.hl7.org/ValueSet/v2-0232,10,2.3,2.9,1
0233,User,Non-Concur Code/Description,"Table of codes that specify a non-concur code and description for a denied request, used in insurance claims processing.  No suggested values.",Non-concurCode_Description,,N/A (0),,,,2.16.840.1.113883.12.233,,,,,10,2.3,2.9,
0234,HL7,Report Timing,HL7-defined table of codes used to identify the time span of a report or the reason for a report sent to a regulatory agency.,ReportTiming,oo,Universal (3),PES-11,,,2.16.840.1.113883.12.234,2.16.840.1.113883.18.133,http://terminology.hl7.org/CodeSystem/v2-0234,2.16.840.1.113883.21.145,http://terminology.hl7.org/ValueSet/v2-0234,10,2.3,2.9,1
0235,HL7,Report Source,HL7-defined table of codes used to identify where a report sender learned about an event.,ReportSource,oo,Universal (3),PES-12,,,2.16.840.1.113883.12.235,2.16.840.1.113883.18.134,http://terminology.hl7.org/CodeSystem/v2-0235,2.16.840.1.113883.21.146,http://terminology.hl7.org/ValueSet/v2-0235,10,2.3,2.9,1
0236,HL7,Event Reported To,HL7-defined table of codes used to identify the type of entity to which the event has been reported.,EventReportedTo,oo,Universal (3),PES-13,,,2.16.840.1.113883.12.236,2.16.840.1.113883.18.135,http://terminology.hl7.org/CodeSystem/v2-0236,2.16.840.1.113883.21.147,http://terminology.hl7.org/ValueSet/v2-0236,10,2.3,2.9,1
0237,HL7,Event Qualification,HL7-defined table of codes used to qualify an event related to a product experience.,EventQualification,oo,Universal (3),PEO-8,,,2.16.840.1.113883.12.237,2.16.840.1.113883.18.136,http://terminology.hl7.org/CodeSystem/v2-0237,2.16.840.1.113883.21.148,http://terminology.hl7.org/ValueSet/v2-0237,10,2.3,2.9,1
0238,HL7,Event Seriousness,HL7-defined table of codes used by a sender to designate an event as serious or significant.,EventSeriousness,oo,Universal (3),PEO-9,,,2.16.840.1.113883.12.238,2.16.840.1.113883.18.137,http://terminology.hl7.org/CodeSystem/v2-0238,2.16.840.1.113883.21.149,http://terminology.hl7.org/ValueSet/v2-0238,10,2.3,2.9,1
0239,HL7,Event Expected,HL7-defined table of codes used to communicate whether an event has been judged to be expected or unexpected.,EventExpected,oo,Universal (3),PEO-10,,,2.16.840.1.113883.12.239,2.16.840.1.113883.18.138,http://terminology.hl7.org/CodeSystem/v2-0239,2.16.840.1.113883.21.150,http://terminology.hl7.org/ValueSet/v2-0239,10,2.3,2.9,1
0240,HL7,Event Consequence,HL7-defined table of codes used to describe the impact of an event on a patient.,EventConsequence,oo,Universal (3),PEO-11,,,2.16.840.1.113883.12.240,2.16.840.1.113883.18.139,http://terminology.hl7.org/CodeSystem/v2-0240,2.16.840.1.113883.21.151,http://terminology.hl7.org/ValueSet/v2-0240,10,2.3,2.9,1
0241,HL7,Patient Outcome,HL7-defined table of codes used to describe the overall state of a patient as a result of patient care.,PatientOutcome,oo,Universal (3),PEO-12,,,2.16.840.1.113883.12.241,2.16.840.1.113883.18.140,http://terminology.hl7.org/CodeSystem/v2-0241,2.16.840.1.113883.21.152,http://terminology.hl7.org/ValueSet/v2-0241,10,2.3,2.9,1
0242,HL7,Primary Observer's Qualification,HL7-defined table of codes used to provide a general description of the kind of health care professional who provided the primary observation.,PrimaryObserversQualification,oo,Universal (3),"PEO-22, PEO-23, PCR-19",,,2.16.840.1.113883.12.242,2.16.840.1.113883.18.141,http://terminology.hl7.org/CodeSystem/v2-0242,2.16.840.1.113883.21.153,http://terminology.hl7.org/ValueSet/v2-0242,10,2.3,2.9,1
0243,HL7,Identity May Be Divulged,HL7-defined table of codes used to define whether the primary observer has given permission for their identification information to be provided to a product manufacturer.,IdentityMayBeDivulged,oo,Universal (3),PEO-25,,,2.16.840.1.113883.12.243,2.16.840.1.113883.18.142,http://terminology.hl7.org/CodeSystem/v2-0243,2.16.840.1.113883.21.154,http://terminology.hl7.org/ValueSet/v2-0243,10,2.3,2.9,1
0244,User,Single Use Device,Table of codes that indicate whether a product is designed for a single use.  No suggested values.,SingleUseDevice,oo,N/A (0),PCR-9,,,2.16.840.1.113883.12.244,,,,,10,2.3,2.9,
0245,User,Product Problem,Table of codes used to indicate if a product problem would exist if a product malfunction could lead to death or serious injury.  No suggested values.,ProductProblem,oo,N/A (0),PCR-11,,,2.16.840.1.113883.12.245,,,,,10,2.3,2.9,
0246,User,Product Available for Inspection,Table of codes used to indicate that the product is available for analysis. No suggested values.,ProductAvailableForInspection,oo,N/A (0),PCR-13,,,2.16.840.1.113883.12.246,,,,,10,2.3,2.9,
0247,HL7,Status of Evaluation,HL7-defined table of codes that describes the status of product evaluation.,StatusOfEvaluation,oo,Universal (3),PCR-15,,,2.16.840.1.113883.12.247,2.16.840.1.113883.18.143,http://terminology.hl7.org/CodeSystem/v2-0247,2.16.840.1.113883.21.155,http://terminology.hl7.org/ValueSet/v2-0247,10,2.3,2.9,1
0248,HL7,Product Source,HL7-defined table of codes used to describe the evaluation state of a product identified in an incident.,ProductSource,oo,Universal (3),PCR-17,,,2.16.840.1.113883.12.248,2.16.840.1.113883.18.144,http://terminology.hl7.org/CodeSystem/v2-0248,2.16.840.1.113883.21.156,http://terminology.hl7.org/ValueSet/v2-0248,10,2.3,2.9,1
0249,User,Generic Product,Table of codes used to indicate whether the product used is a generic or a branded product. No suggested values.,GenericProduct,oo,N/A (0),PCR-2,,,2.16.840.1.113883.12.249,,,,,10,2.3,2.9,
0250,HL7,Relatedness Assessment,HL7-defined table of codes used to provide an estimate of whether an issue with a  product was the cause of an event.,RelatednessAssessment,oo,Universal (3),PCR-20,,,2.16.840.1.113883.12.250,2.16.840.1.113883.18.145,http://terminology.hl7.org/CodeSystem/v2-0250,2.16.840.1.113883.21.157,http://terminology.hl7.org/ValueSet/v2-0250,10,2.3,2.9,1
0251,HL7,Action Taken in Response to the Event,HL7-defined table of codes used to define the action taken as a result of an event related to a product issue.,ActionTakenInResponseToTheEvent,oo,Universal (3),PCR-21,,,2.16.840.1.113883.12.251,2.16.840.1.113883.18.146,http://terminology.hl7.org/CodeSystem/v2-0251,2.16.840.1.113883.21.158,http://terminology.hl7.org/ValueSet/v2-0251,10,2.3,2.9,1
0252,HL7,Causality Observations,HL7-defined table of codes used to record event observations regarding what may have caused a product related event.,CausalityObservations,oo,Universal (3),PCR-22,,,2.16.840.1.113883.12.252,2.16.840.1.113883.18.147,http://terminology.hl7.org/CodeSystem/v2-0252,2.16.840.1.113883.21.159,http://terminology.hl7.org/ValueSet/v2-0252,10,2.3,2.9,1
0253,HL7,Indirect Exposure Mechanism,HL7-defined table of codes used to identify the mechanism of product transmission when the product has not been directly applied to the patient.,IndirectExposureMechanism,oo,Universal (3),PCR-23,,,2.16.840.1.113883.12.253,2.16.840.1.113883.18.148,http://terminology.hl7.org/CodeSystem/v2-0253,2.16.840.1.113883.21.160,http://terminology.hl7.org/ValueSet/v2-0253,10,2.3,2.9,1
0254,HL7,Kind of Quantity,"HL7-defined table of codes that describe the underlying kind of property represented by an observation.  The categories distinguish concentrations from total amounts, molar concentrations from mass concentrations, partial pressures from colors, and so forth.  These are discussed more fully in the LOINC Users' Manual.   They are derived from the approach described in 1995 edition of the IUPAC Silver Book.  These distinctions are used in IUPAC and LOINC standard codes.  The distinctions of true quantities in this table are based primarily on dimensional analyses. The table contains a number of ""families,"" those related to simple counts (number, number concentration, etc.), to mass (mass, mass concentration, etc.), to enzyme activity (catalytic content, catalytic concentration, etc.), and molar or equivalents (substance content, substance concentration).",KindOfQuantity,inm,Universal (3),OM1-42,,,2.16.840.1.113883.12.254,2.16.840.1.113883.18.149,http://terminology.hl7.org/CodeSystem/v2-0254,2.16.840.1.113883.21.161,http://terminology.hl7.org/ValueSet/v2-0254,10,2.3,2.9,1
0255,User,Duration Categories,Table of codes used to classify an observation definition as intended to measure a patient's state at a point in time.,DurationCategories,oo,Representative (2),OM1-43,,,2.16.840.1.113883.12.255,2.16.840.1.113883.18.150,http://terminology.hl7.org/CodeSystem/v2-0255,2.16.840.1.113883.21.162,http://terminology.hl7.org/ValueSet/v2-0255,10,2.3,2.9,1
0256,HL7,Time Delay Post Challenge,HL7-defined table of codes used to classify an observation definition as being a component of a challenge test.,TimeDelayPostChallenge,oo,Universal (3),OM1-44,,,2.16.840.1.113883.12.256,2.16.840.1.113883.18.151,http://terminology.hl7.org/CodeSystem/v2-0256,2.16.840.1.113883.21.163,http://terminology.hl7.org/ValueSet/v2-0256,10,2.3,2.9,1
0257,HL7,Nature of Challenge,HL7-defined table of codes used to further describe an observation definition that is characterized as a challenge observation.,NatureOfChallenge,oo,Universal (3),OM1-44,,,2.16.840.1.113883.12.257,2.16.840.1.113883.18.152,http://terminology.hl7.org/CodeSystem/v2-0257,2.16.840.1.113883.21.164,http://terminology.hl7.org/ValueSet/v2-0257,10,2.3,2.9,1
0258,HL7,Relationship Modifier,HL7-defined table of codes used in an observation definition to describe the subject of an observation in relation to a patient.,RelationshipModifier,oo,Universal (3),OM1-45,,,2.16.840.1.113883.12.258,2.16.840.1.113883.18.153,http://terminology.hl7.org/CodeSystem/v2-0258,2.16.840.1.113883.21.165,http://terminology.hl7.org/ValueSet/v2-0258,10,2.3,2.9,1
0259,User,Modality,Table of codes used to define the imaging apparatus expected to be used to acquire an observation.  This table has been removed from the standard as of 2.7 in favor of table 0910.,Modality,oo,Representative (2),OM1-47,,UTG Missing CodeSystem,2.16.840.1.113883.12.259,2.16.840.1.113883.18.154,http://terminology.hl7.org/CodeSystem/v2-0259,2.16.840.1.113883.21.166,http://terminology.hl7.org/ValueSet/v2-0259,10,2.3,2.9,1
0260,User,Patient Location Type,Table of codes used to identify the kind of location described in the location definition.,PatientLocationType,pa,Example (1),LOC-3,,,2.16.840.1.113883.12.260,2.16.840.1.113883.18.155,http://terminology.hl7.org/CodeSystem/v2-0260,2.16.840.1.113883.21.167,http://terminology.hl7.org/ValueSet/v2-0260,10,2.3,2.9,1
0261,User,Location Equipment,Table of codes used to identify the equipment available in a location definition identified as a room or bed.,LocationEquipment,pa,Example (1),LOC-8,,,2.16.840.1.113883.12.261,2.16.840.1.113883.18.156,http://terminology.hl7.org/CodeSystem/v2-0261,2.16.840.1.113883.21.168,http://terminology.hl7.org/ValueSet/v2-0261,10,2.3,2.9,1
0262,User,Privacy Level,Table of codes used to identify the level of privacy a patient will be afforded when assigned to this location definition.,PrivacyLevel,pa,Representative (2),LCH-5,,,2.16.840.1.113883.12.262,2.16.840.1.113883.18.157,http://terminology.hl7.org/CodeSystem/v2-0262,2.16.840.1.113883.21.169,http://terminology.hl7.org/ValueSet/v2-0262,10,2.3,2.9,1
0263,User,Level of Care,Table of codes used to identify the level of care a patient may be afforded when assigned to this location definition.,LevelOfCare,pa,Example (1),LCH-5,,,2.16.840.1.113883.12.263,2.16.840.1.113883.18.158,http://terminology.hl7.org/CodeSystem/v2-0263,2.16.840.1.113883.21.170,http://terminology.hl7.org/ValueSet/v2-0263,10,2.3,2.9,1
0264,User,Location Department,"Table of codes used to specify the institutions department to which a location belongs, or its cost center.",LocationDepartment,pa,N/A (0),LDP-2,,,2.16.840.1.113883.12.264,,,,,10,2.3,2.9,
0265,User,Specialty Type,Table of codes used to identify the specialty of the care professional who is supported when using this location definition.,SpecialtyType,pa,Example (1),LDP-4,,,2.16.840.1.113883.12.265,2.16.840.1.113883.18.159,http://terminology.hl7.org/CodeSystem/v2-0265,2.16.840.1.113883.21.171,http://terminology.hl7.org/ValueSet/v2-0265,10,2.3,2.9,1
