0490,HL7,Specimen Reject Reason,HL7-defined table of codes specifying the reasons a specimen may be rejected for a specified observation/result/analysis.,SpecimenRejectReason,oo,Universal (3),SPM-21,,,2.16.840.1.113883.12.490,2.16.840.1.113883.18.314,http://terminology.hl7.org/CodeSystem/v2-0490,2.16.840.1.113883.21.330,http://terminology.hl7.org/ValueSet/v2-0490,10,2.5,2.9,1
0491,User,Specimen Quality,Table of codes specifying the degree or grade of excellence of the specimen at receipt.,SpecimenQuality,oo,N/A (0),SPM-22,,,2.16.840.1.113883.12.491,2.16.840.1.113883.18.315,http://terminology.hl7.org/CodeSystem/v2-0491,2.16.840.1.113883.21.331,http://terminology.hl7.org/ValueSet/v2-0491,10,2.5,2.9,1
0492,User,Specimen Appropriateness,Table of codes specifying the suitability of the specimen for the particular planned use as determined by the filler.,SpecimenAppropriateness,oo,N/A (0),SPM-23,,,2.16.840.1.113883.12.492,2.16.840.1.113883.18.316,http://terminology.hl7.org/CodeSystem/v2-0492,2.16.840.1.113883.21.332,http://terminology.hl7.org/ValueSet/v2-0492,10,2.5,2.9,1
0493,User,Specimen Condition,Table of codes specifying a mode or state of being that describes the nature of the specimen.,SpecimenCondition,oo,N/A (0),SPM-24,,,2.16.840.1.113883.12.493,2.16.840.1.113883.18.317,http://terminology.hl7.org/CodeSystem/v2-0493,2.16.840.1.113883.21.333,http://terminology.hl7.org/ValueSet/v2-0493,10,2.5,2.9,1
0494,HL7,Specimen Child Role,HL7-defined table of codes specifying for child specimens the relationship between this specimen and the parent specimen.,SpecimenChildRole,oo,Universal (3),SPM-29,,,2.16.840.1.113883.12.494,2.16.840.1.113883.18.318,http://terminology.hl7.org/CodeSystem/v2-0494,2.16.840.1.113883.21.334,http://terminology.hl7.org/ValueSet/v2-0494,10,2.5,2.9,1
0495,HL7,Body Site Modifier,HL7-defined table of codes specifying the modifier for the body site.,BodySiteModifier,oo,Universal (3),RXR-6,,,2.16.840.1.113883.12.495,2.16.840.1.113883.18.319,http://terminology.hl7.org/CodeSystem/v2-0495,2.16.840.1.113883.21.335,http://terminology.hl7.org/ValueSet/v2-0495,10,2.5,2.9,1
0496,User,Consent Type,"Table of codes specifying to what the subject is consenting, i.e. what type of service, surgical procedure, information access/release or other event.",ConsentType,sd,Representative (2),TXA:2; CON:2,,,2.16.840.1.113883.12.496,2.16.840.1.113883.18.320,http://terminology.hl7.org/CodeSystem/v2-0496,2.16.840.1.113883.21.336,http://terminology.hl7.org/ValueSet/v2-0496,10,2.5,2.9,1
0497,HL7,Consent Mode,HL7-defined table of codes specifying the method in which a subject provides consent.,ConsentMode,sd,Universal (3),TXA:10; CON:10,,,2.16.840.1.113883.12.497,2.16.840.1.113883.18.321,http://terminology.hl7.org/CodeSystem/v2-0497,2.16.840.1.113883.21.337,http://terminology.hl7.org/ValueSet/v2-0497,10,2.5,2.9,1
0498,HL7,Consent Status,HL7-defined table of codes specifying whether the consent has been sought and granted.,ConsentStatus,sd,Universal (3),TXA:11; CON:11,,,2.16.840.1.113883.12.498,2.16.840.1.113883.18.322,http://terminology.hl7.org/CodeSystem/v2-0498,2.16.840.1.113883.21.338,http://terminology.hl7.org/ValueSet/v2-0498,10,2.5,2.9,1
0499,User,Consent Bypass Reason,Table of codes specifying the reason the subject's consent was not sought.,ConsentBypassReason,sd,Example (1),CON:20,,,2.16.840.1.113883.12.499,2.16.840.1.113883.18.323,http://terminology.hl7.org/CodeSystem/v2-0499,2.16.840.1.113883.21.339,http://terminology.hl7.org/ValueSet/v2-0499,10,2.5,2.9,1
0500,HL7,Consent Disclosure Level,HL7-defined table of codes used to specify how much information was disclosed to the subject as part of the informed consent process.,ConsentDisclosureLevel,sd,Universal (3),CON:21,,,2.16.840.1.113883.12.500,2.16.840.1.113883.18.324,http://terminology.hl7.org/CodeSystem/v2-0500,2.16.840.1.113883.21.340,http://terminology.hl7.org/ValueSet/v2-0500,10,2.5,2.9,1
0501,User,Consent Non-Disclosure Reason,Table of codes used to specify a reason the subject did not receive full disclosure.,ConsentNon-disclosureReason,sd,Example (1),CON:22,,,2.16.840.1.113883.12.501,2.16.840.1.113883.18.325,http://terminology.hl7.org/CodeSystem/v2-0501,2.16.840.1.113883.21.341,http://terminology.hl7.org/ValueSet/v2-0501,10,2.5,2.9,1
0502,User,Non-Subject Consenter Reason,HL7-defined table of codes used to specify a reason consent was granted by a person other than the subject of the consent.,Non-subjectConsenterReason,sd,Representative (2),CON:23,,,2.16.840.1.113883.12.502,2.16.840.1.113883.18.326,http://terminology.hl7.org/CodeSystem/v2-0502,2.16.840.1.113883.21.342,http://terminology.hl7.org/ValueSet/v2-0502,10,2.5,2.9,1
0503,HL7,Sequence/Results Flag,HL7-defined table of codes used to specify the sequencing relationship between the current service request and the related service request(s) specified in this TQ2 segment.,Sequence_ResultsFlag,oo,Universal (3),TQ2-2,,,2.16.840.1.113883.12.503,2.16.840.1.113883.18.327,http://terminology.hl7.org/CodeSystem/v2-0503,2.16.840.1.113883.21.343,http://terminology.hl7.org/ValueSet/v2-0503,10,2.5,2.9,1
0504,HL7,Sequence Condition Code,"HL7-defined table of codes used to specify the relationship between the start/end of the related service request(s) (from TQ2-3, TQ2-4 or TQ2-5) and the current service request from ORC-2, 3 or 4.",SequenceConditionCode,oo,Universal (3),TQ2-6,,,2.16.840.1.113883.12.504,2.16.840.1.113883.18.328,http://terminology.hl7.org/CodeSystem/v2-0504,2.16.840.1.113883.21.344,http://terminology.hl7.org/ValueSet/v2-0504,10,2.5,2.9,1
0505,HL7,Cyclic Entry/Exit Indicator,HL7-defined table of codes used to specify if this service request is the first or last service request in a cyclic series of service requests.,CyclicEntry_ExitIndicator,oo,Universal (3),TQ2-7,,,2.16.840.1.113883.12.505,2.16.840.1.113883.18.329,http://terminology.hl7.org/CodeSystem/v2-0505,2.16.840.1.113883.21.345,http://terminology.hl7.org/ValueSet/v2-0505,10,2.5,2.9,1
0506,HL7,Service Request Relationship,HL7-defined table of codes used to specify an additional or alternate relationship between this service request and other service requests.,ServiceRequestRelationship,oo,Universal (3),TQ2-10,,,2.16.840.1.113883.12.506,2.16.840.1.113883.18.330,http://terminology.hl7.org/CodeSystem/v2-0506,2.16.840.1.113883.21.346,http://terminology.hl7.org/ValueSet/v2-0506,10,2.5,2.9,1
0507,User,Observation Result Handling,"Table of codes regarding the handling of a result.  For example, an order may specify that the result (e.g., an x-ray film) should be given to the patient for return to the requestor.",ObservationResultHandling,oo,Example (1),OBR-49,,,2.16.840.1.113883.12.507,2.16.840.1.113883.18.331,http://terminology.hl7.org/CodeSystem/v2-0507,2.16.840.1.113883.21.347,http://terminology.hl7.org/ValueSet/v2-0507,10,2.5,2.9,1
0508,User,Blood Product Processing Requirements,Table of codes used to specify additional information about the blood component class associated with the Universal Service ID.  The placer of the order can specify any required processing of the blood product that must be completed prior to transfusion to the intended recipient.,BloodProductProcessingRequirements,oo,Example (1),BPO-3,,,2.16.840.1.113883.12.508,2.16.840.1.113883.18.332,http://terminology.hl7.org/CodeSystem/v2-0508,2.16.840.1.113883.21.348,http://terminology.hl7.org/ValueSet/v2-0508,10,2.5,2.9,1
0509,User,Indication for Use,Table of codes that specify the reason the blood product was ordered.  No suggested values.,IndicationForUse,oo,N/A (0),BPO-13,,,2.16.840.1.113883.12.509,,,,,10,2.5,2.9,
0510,HL7,Blood Product Dispense Status,"HL7-defined table of codes used to specify the current status of the specified blood product as indicated by the filler or placer.  For example, the first status change of a product that may trigger a Blood Product Dispense Status Message occurs when it first becomes linked to a patient and is ready to dispense. The placer system may use the Blood Product Dispense Status Message to request the transfusion service to dispense the product.  When the blood product is delivered or issued to a patient, the status of the blood product would be changed to indicate that it has now been ""dispensed"".",BloodProductDispenseStatus,oo,Universal (3),BPX-2,,,2.16.840.1.113883.12.510,2.16.840.1.113883.18.333,http://terminology.hl7.org/CodeSystem/v2-0510,2.16.840.1.113883.21.349,http://terminology.hl7.org/ValueSet/v2-0510,10,2.5,2.9,1
0511,HL7,BP Observation Status Codes Interpretation,"HL7-defined table of codes used to specify the interpretation for the blood product observation status codes.  A status is considered preliminary until a blood product has reached a final disposition for the patient. For example, when the product is first cross-matched and a status message is sent, it would be considered preliminary. When the product is dispensed to the patient, that status would also be considered preliminary.  However, once the product is transfused, the status would be considered final.",BpObservationStatusCodesInterpretation,oo,Universal (3),"BPX-3, BTX-12",,,2.16.840.1.113883.12.511,2.16.840.1.113883.18.334,http://terminology.hl7.org/CodeSystem/v2-0511,2.16.840.1.113883.21.350,http://terminology.hl7.org/ValueSet/v2-0511,10,2.5,2.9,1
0512,User,Commercial Product,"Table of codes that specify a commercial product.  Examples of commercial products are blood derivatives such as Rh Immune Globulin and Factor VIII concentrate, Leukoreduction filters and blood administration sets.  No suggested values.",CommercialProduct,oo,N/A (0),"BPX-8, BTX-5",,,2.16.840.1.113883.12.512,,,,,10,2.5,2.9,
0513,HL7,Blood Product Transfusion/Disposition Status,"HL7-defined table of codes used to specify the current status of the specified blood product as indicated by the placer.  For example, the placer may return the blood product to the transfusion service unused because an IV could not be started. The blood component may have been entered, but the line was clogged and could not be used, in which case the component must be wasted. A final status would indicate that the product has actually been ""transfused.""",BloodProductTransfusion_DispositionStatus,oo,Universal (3),BTX-13,,,2.16.840.1.113883.12.513,2.16.840.1.113883.18.335,http://terminology.hl7.org/CodeSystem/v2-0513,2.16.840.1.113883.21.351,http://terminology.hl7.org/ValueSet/v2-0513,10,2.5,2.9,1
0514,User,Transfusion Adverse Reaction,Table of codes used to specify the type of adverse reaction that the recipient of the blood product experienced.,TransfusionAdverseReaction,oo,Example (1),BTX-18,,,2.16.840.1.113883.12.514,2.16.840.1.113883.18.336,http://terminology.hl7.org/CodeSystem/v2-0514,2.16.840.1.113883.21.352,http://terminology.hl7.org/ValueSet/v2-0514,10,2.5,2.9,1
0515,User,Transfusion Interrupted Reason,Table of codes that specify the reason the transfusion of the blood product was interrupted.  No suggested values.,TransfusionInterruptedReason,oo,N/A (0),BTX-19,,,2.16.840.1.113883.12.515,,,,,10,2.5,2.9,
0516,HL7,Error Severity,"HL7-defined table of codes specifying the severity of an application error as reported during acknowledgment of messages. Knowing if something is Error, Warning or Information is intrinsic to how an application handles the content and the information flow.",ErrorSeverity,inm,Universal (3),ERR-4,,,2.16.840.1.113883.12.516,2.16.840.1.113883.18.337,http://terminology.hl7.org/CodeSystem/v2-0516,2.16.840.1.113883.21.353,http://terminology.hl7.org/ValueSet/v2-0516,10,2.5,2.9,1
0517,User,Inform Person Code,Table of codes used to specify who (if anyone) should be informed of the error.  This field may also be used to indicate that a particular person should NOT be informed of the error (e.g. do not inform patient.),InformPersonCode,inm,Representative (2),ERR-9,,,2.16.840.1.113883.12.517,2.16.840.1.113883.18.338,http://terminology.hl7.org/CodeSystem/v2-0517,2.16.840.1.113883.21.354,http://terminology.hl7.org/ValueSet/v2-0517,10,2.5,2.9,1
0518,User,Override Type,Table of codes used to specify what type of override can be used to override the specific error identified.,OverrideType,inm,Example (1),"ERR-10, OVR-1",,,2.16.840.1.113883.12.518,2.16.840.1.113883.18.339,http://terminology.hl7.org/CodeSystem/v2-0518,2.16.840.1.113883.21.355,http://terminology.hl7.org/ValueSet/v2-0518,10,2.5,2.9,1
0519,User,Override Reason,Table of codes that specify the override codes that can be used to override enforcement of the application rule that generated an error.  No suggested values.,OverrideReason,inm,N/A (0),ERR-11,,,2.16.840.1.113883.12.519,,,,,10,2.5,2.9,
0520,HL7,Message Waiting Priority,"HL7-defined table of codes used to specify how important the most important waiting mesasge is.  For example, if there are 3 low priority messages, 1 medium priority message and 1 high priority message, the message waiting priority would be ""high"", because that is the highest priority of any new message waiting.",V2MessageWaitingPriority,inm,Universal (3),MSA-8,,,2.16.840.1.113883.12.520,2.16.840.1.113883.18.340,http://terminology.hl7.org/CodeSystem/v2-0520,2.16.840.1.113883.21.356,http://terminology.hl7.org/ValueSet/v2-0520,10,2.6,2.9,1
0521,User,Override Code,Table of codes that specify the reason for the business rule override.  No suggested values.,OverrideCode,inm,N/A (0),OVR-2,,,2.16.840.1.113883.12.521,,,,,10,2.5,2.9,
0523,HL7,Computation Type,HL7-defined table of codes used to specify if the change is computed as a percent change or as an absolute change.,ComputationType,oo,Universal (3),DLT.3,,,2.16.840.1.113883.12.523,2.16.840.1.113883.18.341,http://terminology.hl7.org/CodeSystem/v2-0523,2.16.840.1.113883.21.357,http://terminology.hl7.org/ValueSet/v2-0523,10,2.5,2.9,1
0524,HL7,Sequence condition,HL7-defined table of codes that identify whether sequence conditions or a repeating cycle of orders is defined.   This is part of the Order Sequence Definition.,SequenceCondition,,Universal (3),,,,2.16.840.1.113883.12.524,2.16.840.1.113883.18.342,http://terminology.hl7.org/CodeSystem/v2-0524,2.16.840.1.113883.21.358,http://terminology.hl7.org/ValueSet/v2-0524,10,2.5,2.9,1
0525,User,Privilege,Table of codes that specify the institutional privilege.  No suggested values.,Privilege,pa,N/A (0),PIP.1,,,2.16.840.1.113883.12.525,,,,,10,2.5,2.9,
0526,User,Privilege Class,Table of codes that specify the class category of institutional privilege.  No suggested values.,PrivilegeClass,pa,N/A (0),PIP.2,,,2.16.840.1.113883.12.526,,,,,10,2.5,2.9,
0527,HL7,Calendar Alignment,"HL7-defined table of codes used to specify an alignment of the repetition to a calendar (e.g., to distinguish every  30 days from ""the 5th of every month"").",CalendarAlignment,oo,Universal (3),RPT.2,,,2.16.840.1.113883.12.527,2.16.840.1.113883.18.343,http://terminology.hl7.org/CodeSystem/v2-0527,2.16.840.1.113883.21.359,http://terminology.hl7.org/ValueSet/v2-0527,10,2.5,2.9,1
0528,HL7,Event Related Period,HL7-defined table of codes used to specify a common (periodical) activity of daily living.,EventRelatedPeriod,oo,Universal (3),RPT.8,,,2.16.840.1.113883.12.528,2.16.840.1.113883.18.344,http://terminology.hl7.org/CodeSystem/v2-0528,2.16.840.1.113883.21.360,http://terminology.hl7.org/ValueSet/v2-0528,10,2.5,2.9,1
0529,HL7,Precision,HL7-defined table of concepts used to specify the degree of precision of the time stamp.   Table is no longer published as part of the released Standard after version 2.5.1.,Precision,,Universal (3),,,,2.16.840.1.113883.12.529,2.16.840.1.113883.18.345,http://terminology.hl7.org/CodeSystem/v2-0529,2.16.840.1.113883.21.361,http://terminology.hl7.org/ValueSet/v2-0529,10,2.5,2.9,1
0530,User,"Organization, Agency, Department",Table of codes used to specify the agency or department that assigned the identifier in component 1.,Organization_Agency_Department,inm,Example (1),"CX.10, PPN.24, XCN.23",,,2.16.840.1.113883.12.530,2.16.840.1.113883.18.346,http://terminology.hl7.org/CodeSystem/v2-0530,2.16.840.1.113883.21.362,http://terminology.hl7.org/ValueSet/v2-0530,10,2.5,2.9,1
0531,User,Institution,Table of codes that specify the institution where a staff member is or was active.  No suggested values.,Institution,pa,N/A (0),DIN.2,,,2.16.840.1.113883.12.531,,,,,10,2.5,2.9,
0532,HL7,Expanded Yes/no Indicator,"HL7-defined table of codes used to specify an expansion on the original Yes/No indicator table by including ""flavors of null"".  It is intended to be applied to fields where the response is not limited to ""yes"" or ""no"".",ExpandedYes_NoIndicator,inm,Universal (3),Numerous locations,,,2.16.840.1.113883.12.532,2.16.840.1.113883.18.347,http://terminology.hl7.org/CodeSystem/v2-0532,2.16.840.1.113883.21.363,http://terminology.hl7.org/ValueSet/v2-0532,10,2.5,2.9,1
0533,User,Application Error Code,Table of codes that specify the application specific code identifying the specific error that occurred.  No suggested values.,ApplicationErrorCode,inm,N/A (0),ERR-5,,,2.16.840.1.113883.12.533,,,,,10,2.5,2.9,
0534,User,Notify Clergy Code,Table of codes used to specify whether the clergy should be notified.,NotifyClergyCode,pa,Representative (2),PV2-49,,,2.16.840.1.113883.12.534,2.16.840.1.113883.18.348,http://terminology.hl7.org/CodeSystem/v2-0534,2.16.840.1.113883.21.364,http://terminology.hl7.org/ValueSet/v2-0534,10,2.5,2.9,1
0535,User,Signature Code,Table of codes that indicate how a patient/subscriber authorization signature is obtained and how it is being retained by a provider.,SignatureCode,fm,Example (1),IN1-50,,,2.16.840.1.113883.12.535,2.16.840.1.113883.18.349,http://terminology.hl7.org/CodeSystem/v2-0535,2.16.840.1.113883.21.365,http://terminology.hl7.org/ValueSet/v2-0535,10,2.5,2.9,1
0536,User,Certificate Status,Table of codes used to specify the status of the certificate held by the health professional.,CertificateStatus,pa,Representative (2),CER-31,,,2.16.840.1.113883.12.536,2.16.840.1.113883.18.350,http://terminology.hl7.org/CodeSystem/v2-0536,2.16.840.1.113883.21.366,http://terminology.hl7.org/ValueSet/v2-0536,10,2.5,2.9,1
0537,User,Institution,"Table of codes that specify the institution the practitioner began or intends to begin practicing at (e.g., at hospital, at physician organization, at managed care network).  No suggested values.",Institution2,pa,N/A (0),"PRA-9, STF-12",,,2.16.840.1.113883.12.537,,,,,10,2.5,2.9,
0538,User,Institution Relationship Type,Table of codes used to specify the relationship the staff person has with the institution for whom he/she provides services.,InstitutionRelationshipType,pa,Example (1),STF-33,,,2.16.840.1.113883.12.538,2.16.840.1.113883.18.351,http://terminology.hl7.org/CodeSystem/v2-0538,2.16.840.1.113883.21.367,http://terminology.hl7.org/ValueSet/v2-0538,10,2.5,2.9,1
0539,User,Cost Center Code,Table of codes that specify the organization unit in the General Ledger to which the staff member is currently assigned.  No suggested values.,CostCenterCode,pa,N/A (0),STF-36,,,2.16.840.1.113883.12.539,,,,,10,2.5,2.9,
0540,User,Inactive Reason Code,Table of codes used to specify the reason the staff member is inactive.,InactiveReasonCode,pa,Example (1),STF-38,,,2.16.840.1.113883.12.540,2.16.840.1.113883.18.352,http://terminology.hl7.org/CodeSystem/v2-0540,2.16.840.1.113883.21.368,http://terminology.hl7.org/ValueSet/v2-0540,10,2.5,2.9,1
0541,User,Specimen Type Modifier,Table of codes that specify the modifying or qualifying description(s) about the specimen type.  No suggested values.,SpecimenTypeModifier,oo,N/A (0),SPM-5,,,2.16.840.1.113883.12.541,,,,,10,2.5,2.9,
0542,User,Specimen Source Type Modifier,Table of codes that specify the modifying or qualifying description(s) about the specimen source site.  No suggested values.,SpecimenSourceTypeModifier,oo,N/A (0),SPM-9,,,2.16.840.1.113883.12.542,,,,,10,2.5,2.9,
0543,User,Specimen Collection Site,"Table of codes that specify the modifying or qualifying description(s) about the specimen collection site.  This field differs from Specimen Source Site in those cases where the source site must be approached via a particular site (e.g., anatomic location). For example, in the case where a liver biopsy is obtained via a percutaneous needle, the collection site would be the point of entry of the needle. For venous blood collected from the left radial vein, the collection site could be antecubital fossa.  No suggested values.",SpecimenCollectionSite,oo,N/A (0),SPM-10,,,2.16.840.1.113883.12.543,,,,,10,2.5,2.9,
0544,User,Container Condition,"HL7-defined table of codes used to specify at each receipt the status of the container in which the specimen is shipped in chain of custody cases where specimens are moved from lab to lab.  If the container is compromised in any way (seal broken, container cracked or leaking, etc.), then this status needs to be recorded for legal reasons.",ContainerCondition,oo,Representative (2),"SPM-28, SHP-9, PAC-6",,,2.16.840.1.113883.12.544,2.16.840.1.113883.18.353,http://terminology.hl7.org/CodeSystem/v2-0544,2.16.840.1.113883.21.369,http://terminology.hl7.org/ValueSet/v2-0544,10,2.5,2.9,1
0545,User,Language Translated To,Table of codes that specify the language to which the consent material must be translated.  Used in the Consent (CON) segment in Version 2 messaging.  Table is no longer published as part of the released Standard after version 2.5.1.,Language,,N/A (0),,,,2.16.840.1.113883.12.545,,,,,10,2.5,2.9,
0547,User,Jurisdictional Breadth,Table of codes used to specify the breadth/extent of the jurisdiction where the qualification is valid.,JurisdictionalBreadth,pa,Example (1),CER-22,,,2.16.840.1.113883.12.547,2.16.840.1.113883.18.354,http://terminology.hl7.org/CodeSystem/v2-0547,2.16.840.1.113883.21.370,http://terminology.hl7.org/ValueSet/v2-0547,10,2.5,2.9,1
0548,User,Signatory's Relationship to Subject,Table of codes used to specify the relationship of the consenter to the subject.,SignatorysRelationshipToSubject,sd,Representative (2),CON:25,,,2.16.840.1.113883.12.548,2.16.840.1.113883.18.355,http://terminology.hl7.org/CodeSystem/v2-0548,2.16.840.1.113883.21.371,http://terminology.hl7.org/ValueSet/v2-0548,10,2.5,2.9,1
0549,Externally defined,NDC Codes,Table of codes that specify the National Drug Codes (NDC) that are required by the Health Insurance Portability and Accountability Act (HIPAA) for electronic claims for pharmacy charges.  No suggested values.,NdcCodes,fm,N/A (0),FT1-29,,,2.16.840.1.113883.12.549,,,,,10,2.5,2.9,
0550,HL7,Body Parts,HL7-defined table of codes used to specify the part of the body.,BodyParts,oo,Universal (3),RXR-2,,,2.16.840.1.113883.12.550,2.16.840.1.113883.18.356,http://terminology.hl7.org/CodeSystem/v2-0550,2.16.840.1.113883.21.372,http://terminology.hl7.org/ValueSet/v2-0552,10,2.5,2.9,1
0552,HL7,Advanced Beneficiary Notice Override Reason,Table of codes that specify the reason the patient did not sign an Advanced Beneficiary Notice.  No suggested values.,AdvancedBeneficiaryNoticeOverrideReason,oo,Universal (3),ORC-26,,,2.16.840.1.113883.12.552,,,2.16.840.1.113883.21.372,http://terminology.hl7.org/ValueSet/v2-0552,10,2.5,2.9,1
0553,User,Invoice Control Code,Table of codes used to specify what invoice action is being performed by this message.,InvoiceControlCode,fm,Representative (2),IVC-4,,,2.16.840.1.113883.12.553,2.16.840.1.113883.18.357,http://terminology.hl7.org/CodeSystem/v2-0553,2.16.840.1.113883.21.373,http://terminology.hl7.org/ValueSet/v2-0553,10,2.6,2.9,1
0554,User,Invoice Reason Codes,Table of codes used to specify the reason for an invoice.,InvoiceReasonCodes,fm,Example (1),IVC-5,,,2.16.840.1.113883.12.554,2.16.840.1.113883.18.358,http://terminology.hl7.org/CodeSystem/v2-0554,2.16.840.1.113883.21.374,http://terminology.hl7.org/ValueSet/v2-0554,10,2.6,2.9,1
0555,User,Invoice Type,Table of codes used to specify the type of invoice.,InvoiceType,fm,Example (1),IVC-6,,,2.16.840.1.113883.12.555,2.16.840.1.113883.18.359,http://terminology.hl7.org/CodeSystem/v2-0555,2.16.840.1.113883.21.375,http://terminology.hl7.org/ValueSet/v2-0555,10,2.6,2.9,1
0556,User,Benefit Group,Table of codes used to specify the benefit group.,BenefitGroup,fm,Example (1),IVC-25,,,2.16.840.1.113883.12.556,2.16.840.1.113883.18.360,http://terminology.hl7.org/CodeSystem/v2-0556,2.16.840.1.113883.21.376,http://terminology.hl7.org/ValueSet/v2-0556,10,2.6,2.9,1
0557,User,Payee Type,"Table of codes used to specify the type of payee (e.g., organization, person).",PayeeType,fm,Representative (2),PYE-2,,,2.16.840.1.113883.12.557,2.16.840.1.113883.18.361,http://terminology.hl7.org/CodeSystem/v2-0557,2.16.840.1.113883.21.377,http://terminology.hl7.org/ValueSet/v2-0557,10,2.6,2.9,1
0558,User,Payee Relationship to Invoice,Table of codes used to specify the relationship to the invoice for Person Payee Types.,PayeeRelationshipToInvoice,fm,Example (1),PYE-3,,,2.16.840.1.113883.12.558,2.16.840.1.113883.18.362,http://terminology.hl7.org/CodeSystem/v2-0558,2.16.840.1.113883.21.378,http://terminology.hl7.org/ValueSet/v2-0558,10,2.6,2.9,1
0559,User,Product/Service Status,Table of codes used to specify the processing status for the Product/Service Code.,Product_ServiceStatus,fm,Representative (2),PLS-6,,,2.16.840.1.113883.12.559,2.16.840.1.113883.18.363,http://terminology.hl7.org/CodeSystem/v2-0559,2.16.840.1.113883.21.379,http://terminology.hl7.org/ValueSet/v2-0559,10,2.6,2.9,1
0560,User,Quantity Units,Table of codes that specify the adjustment quantity.  No suggested values.,QuantityUnits,fm,Example (1),ADJ-6,,,2.16.840.1.113883.12.560,2.16.840.1.113883.18.455,http://terminology.hl7.org/CodeSystem/v2-0560,2.16.840.1.113883.21.380,http://terminology.hl7.org/ValueSet/v2-0560,10,2.6,2.9,1
0561,User,Product/Services Clarification Codes,Table of codes used to specify the Product/Service Code.,Product_ServicesClarificationCodes,fm,Example (1),PSL-17,,,2.16.840.1.113883.12.561,2.16.840.1.113883.18.364,http://terminology.hl7.org/CodeSystem/v2-0561,2.16.840.1.113883.21.381,http://terminology.hl7.org/ValueSet/v2-0561,10,2.6,2.9,1
